Resistant_Drug_Classes,ACF_Lag12,Seasonal_Strength,Has_Seasonality_ACF,Has_Seasonality_Strength
"AMINOGLYCOSIDES, CARBAPENEMS, CEPHEMS, FLUOROQUINOLONES, FOLATE PATHWAY ANTAGONISTS, β-LACTAM COMBINATION AGENTS",0.44876856063805587,0.42071901725634386,False,True
"AMINOGLYCOSIDES, CARBAPENEMS, CEPHEMS, FLUOROQUINOLONES, β-LACTAM COMBINATION AGENTS",0.24934044552774323,0.2903125687615984,False,False
"CARBAPENEMS, CEPHEMS, FLUOROQUINOLONES, FOLATE PATHWAY ANTAGONISTS, β-LACTAM COMBINATION AGENTS",-0.02235555950107287,0.19437164698721565,False,False
"CARBAPENEMS, CEPHEMS, FLUOROQUINOLONES, β-LACTAM COMBINATION AGENTS",0.039878213149437125,0.16820949195699408,False,False
"CARBAPENEMS, CEPHEMS, FOLATE PATHWAY ANTAGONISTS, β-LACTAM COMBINATION AGENTS",0.16078427170879575,0.33384328464254787,False,True
